{
  "schema_version": "1.0",
  "id": "bnd_01J8ZQ4M7T2V9K3NXW5R6YHBCK",
  "organization_id": "org_example",
  "scope": {
    "type": "organization",
    "id": "org_example"
  },
  "revision": 4,
  "created_at": "2026-09-17T12:00:00Z",
  "expires_at": "2026-09-24T12:00:00Z",
  "failure_mode": {
    "stateful_tier": "fail-open"
  },
  "documents": [
    {
      "kind": "rulebook",
      "name": "rules.json",
      "digest": "sha256:aaaaaaaaaaaaaaaaaaaaaaaaaaaaaaaaaaaaaaaaaaaaaaaaaaaaaaaaaaaaaaaa",
      "media_type": "application/json",
      "body": "{\"rules\":[]}"
    }
  ],
  "content_policy": {
    "sync_content": "consent"
  },
  "signature": {
    "algorithm": "ed25519",
    "key_id": "org-key-2026-09",
    "value": "c2lnbmF0dXJl"
  }
}
